{
    "$schema": "./skill-rules.schema.json",
    "version": "2.0",
    "config": {
        "minConfidenceScore": 3,
        "showMatchReasons": true,
        "maxSkillsToShow": 5
    },
    "scoring": {
        "keyword": 2,
        "keywordPattern": 3,
        "pathPattern": 4,
        "directoryMatch": 5,
        "intentPattern": 4,
        "contentPattern": 3,
        "contextPattern": 2
    },
    "directoryMappings": {
        "src/components/core": "core-components",
        "src/components": "core-components",
        "src/screens": "navigation-architecture",
        "src/navigation": "navigation-architecture",
        "src/hooks": "react-ui-patterns",
        "src/graphql": "graphql-schema",
        "src/localization": "i18n-translations",
        "src/state": "state-management",
        "src/contexts": "state-management",
        ".maestro": "maestro-e2e",
        ".github/workflows": "github-actions",
        "src/utils/sentry": "analytics-tracking",
        "src/datadog": "analytics-tracking"
    },
    "skills": {
        "storybook": {
            "description": "Storybook story creation patterns",
            "priority": 8,
            "triggers": {
                "keywords": ["storybook", "stories", "story"],
                "keywordPatterns": ["\\bstory\\b", "\\.stories\\b"],
                "pathPatterns": ["**/*.stories.tsx", "**/stories/**"],
                "intentPatterns": [
                    "(?:create|add|write|build|make).*(?:stor(?:y|ies))",
                    "(?:stor(?:y|ies)).*(?:for|of)"
                ],
                "contentPatterns": ["ComponentMeta", "StoryObj", "@storybook"]
            },
            "relatedSkills": ["core-components"]
        },
        "testing-patterns": {
            "description": "Jest testing patterns and TDD workflow",
            "priority": 9,
            "triggers": {
                "keywords": ["test", "jest", "spec", "tdd", "mock", "factory"],
                "keywordPatterns": ["\\btest(?:s|ing)?\\b", "\\bspec\\b", "unit test"],
                "pathPatterns": [
                    "**/*.test.ts",
                    "**/*.test.tsx",
                    "**/*.spec.ts",
                    "**/test-utils/**",
                    "**/__mocks__/**"
                ],
                "intentPatterns": [
                    "(?:write|add|create|fix).*(?:test|spec)",
                    "(?:test|spec).*(?:for|of|the)",
                    "(?:red.green.refactor|tdd)"
                ],
                "contentPatterns": ["describe\\(", "it\\(", "expect\\(", "jest\\.mock", "getMock"]
            },
            "excludePatterns": ["e2e", "maestro", "end-to-end"]
        },
        "formik-patterns": {
            "description": "Formik form handling with validation",
            "priority": 7,
            "triggers": {
                "keywords": ["form", "formik", "validation", "yup", "input field"],
                "keywordPatterns": ["\\bform(?:s)?\\b", "Form\\b", "\\bvalidat(?:e|ion)\\b"],
                "pathPatterns": ["**/*Form.tsx", "**/*Form/**", "**/forms/**"],
                "intentPatterns": [
                    "(?:create|build|add).*(?:form)",
                    "(?:form).*(?:validation|submit|field)",
                    "(?:validat(?:e|ion)).*(?:schema|rule)"
                ],
                "contentPatterns": ["useFormik", "Formik", "FormikProvider", "yup\\."]
            },
            "excludePatterns": ["format", "transform", "platform"]
        },
        "graphql-schema": {
            "description": "GraphQL queries, mutations, and code generation",
            "priority": 8,
            "triggers": {
                "keywords": ["graphql", "query", "mutation", "gql", "apollo", "fragment"],
                "keywordPatterns": ["\\bgql\\b", "\\bquery\\b", "\\bmutation\\b", "graphql"],
                "pathPatterns": ["**/*.gql", "**/graphql/**", "**/*.generated.ts"],
                "intentPatterns": [
                    "(?:create|add|write).*(?:query|mutation|fragment)",
                    "(?:fetch|get|load).*(?:data|from api)",
                    "(?:graphql).*(?:hook|type)"
                ],
                "contentPatterns": ["gql`", "useQuery", "useMutation", "useLazyQuery"]
            },
            "relatedSkills": ["react-ui-patterns"]
        },
        "navigation-architecture": {
            "description": "React Navigation patterns and deep linking",
            "priority": 7,
            "triggers": {
                "keywords": [
                    "navigation",
                    "navigate",
                    "screen",
                    "route",
                    "stack",
                    "tab",
                    "drawer",
                    "deep link"
                ],
                "keywordPatterns": ["\\bscreen\\b", "\\bnavigate\\b", "\\broute\\b"],
                "pathPatterns": [
                    "**/navigation/**",
                    "**/screens/**",
                    "**/*Screen.tsx",
                    "**/*Stack.tsx"
                ],
                "intentPatterns": [
                    "(?:add|create|new).*(?:screen)",
                    "(?:navigate|go).*(?:to|back)",
                    "(?:screen).*(?:param|prop)"
                ],
                "contentPatterns": [
                    "useNavigation",
                    "navigation\\.navigate",
                    "createStackNavigator",
                    "RootStackParamList"
                ]
            }
        },
        "i18n-translations": {
            "description": "Internationalization and translation patterns",
            "priority": 6,
            "triggers": {
                "keywords": ["translation", "i18n", "localization", "translate", "t("],
                "keywordPatterns": ["\\bt\\(", "\\bi18n\\b", "translat"],
                "pathPatterns": ["**/localization/**", "**/en/**/*.json", "**/i18n/**"],
                "intentPatterns": [
                    "(?:add|create).*(?:translation|text)",
                    "(?:translat).*(?:key|string)"
                ],
                "contentPatterns": ["useTranslation", "t\\(", "i18next"]
            }
        },
        "core-components": {
            "description": "Core component library and design system",
            "priority": 7,
            "triggers": {
                "keywords": [
                    "component",
                    "ui",
                    "button",
                    "text",
                    "box",
                    "hstack",
                    "vstack",
                    "token"
                ],
                "keywordPatterns": ["\\bcomponent\\b", "\\$[a-z]+\\d*"],
                "pathPatterns": ["**/components/core/**", "**/components/**/*.tsx"],
                "intentPatterns": [
                    "(?:create|build|add).*(?:component)",
                    "(?:style|design).*(?:component|ui)"
                ],
                "contentPatterns": ["from 'components/core", "Box", "HStack", "VStack", "Text"]
            },
            "excludePatterns": ["storybook", "test"]
        },
        "systematic-debugging": {
            "description": "Four-phase debugging with root cause analysis",
            "priority": 9,
            "triggers": {
                "keywords": ["bug", "debug", "fix", "error", "issue", "broken", "crash", "failing"],
                "keywordPatterns": [
                    "\\bbug\\b",
                    "\\bfix\\b",
                    "\\berror\\b",
                    "\\bissue\\b",
                    "doesn't work",
                    "not working"
                ],
                "intentPatterns": [
                    "(?:fix|debug|resolve|investigate).*(?:bug|error|issue|problem)",
                    "(?:why).*(?:not working|broken|failing|crash)",
                    "(?:something).*(?:wrong|broken)"
                ]
            },
            "excludePatterns": ["fix typo", "fix formatting", "fix lint"]
        },
        "state-management": {
            "description": "Redux Toolkit, Jotai, Apollo Client state patterns",
            "priority": 6,
            "triggers": {
                "keywords": [
                    "state",
                    "redux",
                    "jotai",
                    "atom",
                    "store",
                    "slice",
                    "context",
                    "provider"
                ],
                "keywordPatterns": ["\\bstate\\b", "\\bredux\\b", "\\batom\\b", "\\bstore\\b"],
                "pathPatterns": [
                    "**/state/**",
                    "**/store/**",
                    "**/contexts/**",
                    "**/*Atom.ts",
                    "**/*Slice.ts"
                ],
                "intentPatterns": [
                    "(?:manage|handle).*(?:state)",
                    "(?:create|add).*(?:atom|slice|context)"
                ],
                "contentPatterns": ["useAtom", "useSelector", "createSlice", "atom\\("]
            },
            "excludePatterns": ["state of", "current state", "error state"]
        },
        "github-actions": {
            "description": "GitHub Actions CI/CD workflow patterns",
            "priority": 6,
            "triggers": {
                "keywords": [
                    "github action",
                    "github workflow",
                    "workflow",
                    "ci/cd",
                    "cicd",
                    "pipeline",
                    "ci",
                    "cd"
                ],
                "keywordPatterns": ["github.action", "ci/?cd", "\\bworkflow\\b"],
                "pathPatterns": [".github/workflows/**", ".github/**/*.yml", ".github/**/*.yaml"],
                "intentPatterns": [
                    "(?:create|add|update).*(?:workflow|action|pipeline)",
                    "(?:ci|cd).*(?:pipeline|workflow)"
                ],